title,abstract,year,pmid,source,paperId,study_design,base_score,sample_size,evidence_score
piperine-induced ampk activation and cell cycle arrest: insights from molecular simulations and experimental validation in breast cancer.,"breast cancer remains a leading cause of mortality among women, underscoring the need for novel, low-toxicity therapeutic strategies. piperine, a bioactive alkaloid derived from piper nigrum, has shown promising anticancer activity; however, its mechanistic link to ampk activation remains insufficiently explored. in this study, we investigated the role of ampk modulation in piperine-induced apoptosis in mcf-7 (luminal a, er-positive) breast cancer cells by integrating in silico molecular docking and 100 ns molecular dynamics (md) simulations with comprehensive in vitro validation. molecular docking revealed that piperine binds at the ampk alpha-beta interface (adam-like site) with a favorable binding affinity (- 6.3 kcal/mol), comparable to the reference ampk activator metformin (- 6.8 kcal/mol). md simulations demonstrated stable ligand-protein interactions and conformational stabilization of ampk over 100 ns. functionally, piperine exhibited a time-dependent cytotoxic effect with ic(5)(0) values of 81 microm (24 h), 44 microm (48 h), and 15 microm (72 h) as determined by mtt assay. annexin v-fitc/pi analysis showed significant apoptosis induction, with total apoptotic populations of 37.6 +/- 2.95% at 50 microm and 69.3 +/- 2.85% at 100 microm. cell cycle analysis revealed a marked arrest at the g2/m phase (~ 20-22%).additionally, piperine significantly inhibited cancer cell migration, reducing wound closure at 24 h to 29.5 +/- 0.3% (50 microm) and 18.8 +/- 0.2% (100 microm) compared to 45.3 +/- 0.4% in controls, and at 48 h to 48.1 +/- 0.2% and 27.6 +/- 0.3%, respectively (control: 72.4 +/- 0.6%). collectively, these findings demonstrate that piperine effectively modulates ampk signaling, correlating with apoptosis induction, cell-cycle arrest, and impaired migratory capacity in breast cancer cells, thereby highlighting its potential as an ampk-targeting therapeutic candidate for luminal a breast cancer.",2026 Mar 3,41774315.0,PubMed,,Preclinical Study (In Vitro / In Vivo Animal),2.0,-1,2.0
metformin as an immunometabolic modulator in breast cancer: integrating nk and nkt cell responses.,"breast cancer progression is increasingly recognized as an immunometabolic disorder in which tumor-intrinsic metabolic reprogramming and microenvironmental stress converge to impair innate immune surveillance. beyond its established role in glycemic control, metformin has emerged as a promising immunometabolic modulator with anticancer potential. accumulating evidence indicates that metformin suppresses breast tumor growth by targeting key metabolic vulnerabilities, including dysregulated glycolysis, lipid metabolism, and mitochondrial energetics, while simultaneously restoring the functional competence of innate immune effectors, particularly natural killer (nk) and natural killer t (nkt) cells. at the molecular level, metformin engages amp-activated protein kinase (ampk)-centered signaling and mitochondrial complex i-associated energetic stress, leading to downstream modulation of mtor activity, redox balance, autophagy, and rna-mediated regulatory networks. these coordinated effects reduce tumor cell plasticity and enhance immune permissiveness. within the tumor microenvironment, metformin attenuates hormone-dependent stromal support, disrupts immunosuppressive myeloid networks, normalizes chemokine and cytokine profiles, and promotes antigen presentation and innate immune cell recruitment. preclinical studies consistently demonstrate delayed tumor onset, suppression of aggressive breast cancer subtypes, impairment of cancer stem cell maintenance, and reinforcement of nk/nkt-mediated antitumor surveillance following metformin treatment. however, emerging clinical and translational evidence suggests that therapeutic efficacy is context dependent, influenced by tumor molecular subtype, host metabolic status, immune composition, and pathway-specific biomarker engagement. this review critically synthesizes mechanistic, preclinical, and clinical findings to position metformin as a host-directed immunometabolic adjuvant in breast cancer. integrating insights from metabolism, innate immunology, pharmacology, and biotechnology, this work highlights opportunities for biomarker-guided stratification and rational combination strategies aimed at enhancing nk/nkt-cell-driven antitumor immunity in breast cancer therapy.",2026 Mar,41768419.0,PubMed,,Narrative Review / Editorial / Commentary,4.0,-1,4.0
relationship between breast cancer and metformin: a bibliometric review.,"background: a complex relationship exists between diabetes, particularly type 2 diabetes, and breast cancer. metformin can help reduce the incidence of cancer and the risk of death in individuals with type 2 diabetes. this study utilized bibliometrics to analyze the potential impact of diabetes drugs on the treatment of breast cancer, aiming to reveal research trends and provide references for future research directions. methods: this bibliometric study analyzed the intersection of diabetes, breast cancer, and metformin using data from the web of science core collection and pubmed (2004-2024). a total of 1080 relevant publications were included. results: an initial slow growth in publications was noted, followed by a surge starting in 2008. the usa and china led these research efforts, with goodwin pj having the highest number of publications. the journal diabetes care was the most co-cited, with keywords such as ""breast cancer,"" ""risk,"" ""metformin,"" and ""growth"" frequently appearing. the analysis identified 4036 institutions and 5214 active authors in the field. conclusions: despite growing attention to the role of diabetes medications such as metformin in breast cancer treatment, research remains limited to mechanistic studies and retrospective clinical analyses. the optimal dose for clinical use remains unclear, which highlights the need for further experimental studies. this study provides valuable insights for both academic and clinical research, supporting the potential use of metformin to manage the relationship between diabetes and breast cancer.",2026 Feb 27,41760031.0,PubMed,,Narrative Review / Editorial / Commentary,4.0,-1,4.0
wbp2 attenuates metformin response in her2-positive breast cancer cells by repressing ampk activation and inducing a lower amp:atp ratio state through enhanced atp production.,"metformin is an antidiabetic drug that has been tested widely as an anti-cancer agent. however, data from clinical trials have been mixed. evidence for metformin's efficacy in her2+ breast cancer exists. hence, we evaluated whether wbp2, a her2-coamplified gene, can regulate the response of her2+ breast cancer to metformin. identification of biomarkers for predicting metformin response has implications in repurposing metformin for precision oncology. the effect of wbp2 on breast cancer response to metformin was studied using in vitro and mouse models. the mechanism of wbp2 on metformin-induced ampk activation was elucidated, and its co-expression with p-ampk was examined in clinical specimens using ihc. rna-seq analyses were performed to elucidate wbp2's mechanism in energy metabolism. wbp2 inhibited the metformin response of her2+ breast cancer in vitro and in vivo. these effects were concomitant with wbp2-mediated repression of metformin-induced ampk activation and mtor inhibition in her2+ breast cancer cells, a lower amp:atp ratio state, and enhanced glycolytic capacity and mitochondria respiration. analysis of her2-positive breast cancer samples supports the negative correlation between wbp2 expression and activated ampk observed in vitro. rna-seq analysis revealed the potential mechanism of wbp2 in regulating atp production processes and preferential effect of wbp2 on metformin response in her2+ breast cancer. this study reported a novel role of wbp2 in cancer metabolism and energetics that contributes new insights into the molecular etiology of cancer. wbp2 may be a biomarker for patient stratification, paving the way towards repurposing metformin for precision oncology.",2026 Feb 23,41744824.0,PubMed,,Clinical Trial (Phase I/II) / Prospective Cohort,8.0,-1,7.5
metformin potentiates dsf/cu-loaded pluronic nanoparticles to improve therapeutic efficacy in triple-negative breast cancer.,"background: triple-negative breast cancer (tnbc) is an aggressive breast cancer subtype characterized by poor prognosis and resistance to conventional therapies, underscoring the need for novel therapeutic strategies. drug repurposing has emerged as a promising approach, with disulfiram (dsf) and metformin demonstrating anticancer potential. in addition, nanoparticle (np)-based drug delivery systems can enhance therapeutic efficacy and tumor selectivity. this study investigates the antitumor effects of a combination therapy using dsf/cu complex-loaded pluronic-based nanoparticles and metformin in tnbc cells. methods: pluronic-based nanoparticles were synthesized using the thin-film hydration method, and hyaluronic acid (ha) was conjugated to pluronic, as confirmed by h-nmr spectroscopy. drug-nanoparticle interactions were characterized using ftir analysis. drug loading efficiency, release profiles, and cellular uptake were evaluated under acidic and physiological conditions. cytotoxic effects of free drugs and np formulations were assessed using the mtt assay, while apoptosis was analyzed by flow cytometry. the expression levels of stat3, cd24, cd44 and aldh1 were quantified by real-time pcr. results: successful conjugation of ha to pluronic was confirmed by h-nmr, and ftir analysis verified physical interactions between the drugs and pluronic micelles. encapsulation efficiencies for dsf and dsf/cu were 89.5% and 73%, respectively. dsf/cu-loaded nanoparticles exhibited a faster drug release under acidic conditions compared to physiological ph. np formulations significantly enhanced cellular uptake and demonstrated a synergistic-like potentiating effect, wherein sub-cytotoxic concentrations of metformin markedly enhanced the anticancer efficacy of dsf/cu-loaded nanoparticles. apoptosis assays revealed increased apoptotic cell death with minimal necrosis. furthermore, real-time pcr analysis showed significant downregulation of stat3 and stemness-associated gene expression compared to untreated controls. conclusion: pluronic-based nanoparticles efficiently encapsulate dsf/cu and enhance its anticancer activity. the combination of metformin with dsf/cu-loaded nanoparticles significantly inhibits tnbc cell growth and reduces stemness properties. this low-toxicity, metabolism-assisted combination strategy shows strong potential for tnbc treatment and warrants further in vivo investigation. supplementary information: the online version contains supplementary material available at 10.1186/s12896-026-01113-5.",2026 Feb 23,41731430.0,PubMed,,Preclinical Study (In Vitro / In Vivo Animal),2.0,-1,2.0
therapeutic switching of metformin using heteroleptic cu(ii) and zn(ii) complexes: a combined experimental and computational study.,"ligands of the antidiabetic drug metformin and the natural flavonoid chrysin were used to synthesize cu-(ii) and zn-(ii) heteroleptic complexes. metal complexation was used to repurpose metformin against the breast cancer cell line mcf-7. structural information on the metal complexes was acquired using uv-vis absorption spectroscopy, ftir, hrms, tga/dta, xrd, sem-edx, molar conductance analysis, and time-dependent density functional theory (tddft). accordingly, we proposed that the structure of complex 1 was [cu-(c(4)h(11)n(5))-(c(15)h(9)o(4))-(c(2)h(3)o(2))], with a square pyramidal geometry, while complex 2 was [zn-(c(4)h(11)n(5))-(c(15)h(9)o(4))]-c(2)h(3)o(2) and exhibited a tetrahedral geometry. the ic(50) values were 18.93 and 43.31 mum for complexes 1 and 2, respectively, compared to the positive control cisplatin (ic(50) = 18.62 mum). the cancer cells' morphology changed from epithelial to a round shape, and the cell density decreased upon treatment, confirming the potential of the metal complexes to induce apoptosis. computationally, the biological significance of the metal complexes was inferred from quantum chemical descriptors and molecular docking analysis. the band gap energies of the metal complexes were 2.964 and 3.648 ev for complexes 1 and 2, respectively, compared to those of metformin (5.988 ev) and chrysin (4.403 ev). moreover, molecular docking simulations against estrogen receptor alpha (eralpha; pdb: 5gs4) revealed a binding energy of -5.69 kcal mol(-1) and an inhibition constant (k (i)) of 51.37 mum for complex 1, and -6.12 kcal mol(-1) and 30.12 mum, respectively, for complex 2. this work demonstrates the therapeutic switching capability of metformin via metal complexation.",2026 Feb 17,41726635.0,PubMed,,Preclinical Study (In Vitro / In Vivo Animal),2.0,-1,2.0
mtor-driven autophagy suppression defines metabolic vulnerability in cdk4/6 inhibitor-resistant hr(+)/her2(-) breast cancer.,"breast cancer (bc) is the most prevalent malignancy in women, with hormone receptor-positive, her2-negative (hr(+)/her2(-)) tumors representing ~70% of cases. while cdk4/6 inhibitors (cdk4/6i) combined with endocrine therapy have transformed treatment for metastatic hr(+)/her2(-) bc, acquired resistance remains a major obstacle. using hr(+)/her2(-) bc models with acquired resistance to the cdk4/6 inhibitors palbociclib or ribociclib, we uncovered a metabolic vulnerability in highly resistant clones, mediated by mtorc1 hyperactivation and autophagy suppression. gene expression profiling revealed enrichment of glycolysis and mtorc1 pathways in cdk4/6i-resistant cells, which manifested as heightened sensitivity to the metabolic inhibitors metformin and dichloroacetate (dca). mechanistically, mtorc1 overactivation impaired autophagy via ulk1-ser757 phosphorylation, as confirmed by lc3 flux assays, leaving resistant cells unable to adapt to energy stress. treatment with metabolic drugs triggered ampk activation, acc inhibition, and parp cleavage, culminating in apoptosis. clinically, immunohistochemical analysis of a bc cohort revealed a significant correlation between mtorc1 activity (p4e-bp1(t37/46)) and autophagy suppression (p62 accumulation), supporting the translational relevance of this axis. our findings propose mtorc1-mediated autophagy defects as a biomarker for metabolic vulnerability in cdk4/6i-resistant bc, offering a rationale for targeting these tumors with metabolic therapies to overcome resistance.",2026 Feb 19,41714320.0,PubMed,,Undetermined / Default,4.0,-1,4.0
impact of type 2 diabetes on malignancies of the female reproductive system.,"type 2 diabetes mellitus (t2dm) contributes significantly to the development and progression of cancers of the female reproductive tissues, particularly endometrial, ovarian, and breast. hallmarks of t2dm, such as hyperinsulinemia, insulin resistance, and chronic low-grade inflammation, disrupt endocrine and metabolic homeostasis, promoting carcinogenesis through enhanced mitogenic signaling, hormonal dysregulation, and immune activation. t2dm can alter ovarian, endometrial, and mammary physiology by affecting estrogen/progesterone receptor activity, stromal remodeling, and specialized cell function. furthermore, give the fluctuations in a woman's hormonal levels and reproductive status, the presence of excess weight and t2dm may have altering risks depending on the lifecycle. these effects are exacerbated by adipose-derived cytokines and leptin resistance, further amplifying estrogens' bioavailability and pro-inflammatory signaling. endometrial cancer risk is nearly doubled in diabetic women, independent of body mass index, with hyperglycemia inducing pi3k/akt/mtor and nf-kappab pathway activation, reduced sex hormone-binding globulin (shbg) levels, and upregulation of estrogen receptor signaling. ovarian cancer in diabetic patients is associated with more aggressive histological subtypes, advanced-stage presentation, and poorer survival, likely driven by insulin-like growth factor 1 (igf-1) signaling, oxidative stress, and impaired treatment response. similarly, t2dm increases the risk and worsens outcomes in breast cancer via enhanced expression, age-rage interactions, and estrogen-independent eralpha activation. herein, we synthesize current epidemiological evidence and mechanistic insights to delineate the multifaceted relationship between t2dm and these cancers. despite increased risk, diabetic women often face underdiagnosis due to suboptimal screening practices. as t2dm prevalence rises globally, tailored cancer prevention and treatment strategies for diabetic populations are urgently needed. metformin has shown robust benefits in reducing t2dm-related complications and potential in the antineoplastic setting. this review underscores the endocrine and inflammatory mechanisms linking t2dm to cancers of the female reproductive system and advocates for integrated clinical protocols that include early screening and individualized management in diabetic women.",2026 Apr,41679247.0,PubMed,,Narrative Review / Editorial / Commentary,4.0,-1,4.0
weight loss patterns and clinical outcomes of glp1 receptor agonists in breast cancer survivors.,"the use of glucagon-like peptide-1 receptor agonists (glp1-ra) for weight loss is increasing; implications in breast cancer survivors remain unclear. this retrospective cohort study evaluated treatment patterns, weight loss, and outcomes in breast cancer survivors receiving glp1-ra at an academic institution. we evaluated patients with nonmetastatic [ductal carcinoma in situ (dcis), stage 1-3] breast cancer who received glp1-ra (2005-2024). linear regression models estimated associations between weight change and clinical factors. after excluding dcis, propensity score matching (1:2) was used to match patients who received glp1-ra with patients who did not, based on confounding covariates. kaplan-meier estimates and log-rank tests compared disease-free survival (dfs) and overall survival (os) between glp1-ra users versus nonusers in the subgroup with invasive disease. we identified 1,022 patients; 79% had type 2 diabetes mellitus. the median weight and body mass index at glp1-ra initiation were 86.8 kg (47.2-175 kg) and 33.5 kg/m2 (18.9-61.8 kg/m2). in semaglutide or tirzepatide users (442, 43.2%), the median weight change at 3, 6, and 12 months after glp1-ra initiation was -1.9% (-13.2% to 14.9%), -3.1% (-20.2% to 19%), and -2.6% (-27.8% to 11.5%), respectively. endocrine therapy and metformin use were associated with weight gain and loss, respectively; invasive disease stage was linked to greater weight loss. glp1-ra was not associated with dfs, but os significantly differed between glp1-ra users (n = 810) and nonusers (n = 1,620; hazard ratio, 0.37; 95% confidence interval, 0.27-0.53; p < 0.0001). in conclusion, in this real-world study in breast cancer survivors, glp1-ra was associated with modest weight loss and improved all-cause survival. clinical trials are warranted to study glp1-ra in this population. significance: this is the largest study describing real-world patterns of glp1 receptor agonists in breast cancer survivors. clinical trials should evaluate these agents for weight management as an adjunct to lifestyle interventions and the potential role in cancer control in breast cancer survivors.",2026 Mar 1,41677473.0,PubMed,,Clinical Trial (Phase I/II) / Prospective Cohort,8.0,810,8.5
unraveling ampk and bet regulation of immune checkpoint biology: implications for personalized medicine.,"triple negative breast cancer (tnbc) patients with comorbid type 2 diabetes (t2d) show worse survival compared to nondiabetic tnbc patients. immune checkpoint blockade (icb) has unclear benefit in tnbc. immune suppression in t2d, and use of metformin, an activator of 5' adenosine monophosphate-activated protein kinase (ampk), in such patients, prompted us to examine ampk regulation of immune checkpoint expression. improved icb efficacy may optimize outcomes for certain tnbc patients. we have also been exploring the role of bromodomain and extraterminal domain (bet) proteins (brd2, brd3, brd4) in regulation of checkpoint molecules in immune cell subsets, including cd4+, cd8+ t cells, and nk cells. bet proteins are important transcriptional co-regulators, critical for proliferation and metastasis in many cancer types, including tnbc. we observed differential bet regulation of immune checkpoint proteins, specifically tim-3, tigit, pd-1 and ctla-4, on alphacd3/alphacd28-stimulated peripheral blood mononuclear cells by flow cytometry. chemical inhibition of ampk with compound c, and with the pan-bet inhibitor jq1 or the brd4-selective protac inhibitor mz-1, revealed that bet proteins regulate pd-1 and ctla-4 through an ampk-dependent pathway and tim-3 and tigit through an ampk-independent pathway. personalized approaches to icb treatment of tnbc patients with comorbid t2d should improve outcomes.",2026 Jan 27,41659635.0,PubMed,,Undetermined / Default,4.0,-1,4.0
a robust rnai nanoplatform for precise activation of cgas-sting pathway and effective immune checkpoint blockade to potentiate cancer immunotherapy.,"activation of cyclic guanosine monophosphate-adenosine monophosphate synthase (cgas)-interferon gene stimulator (sting) pathway has demonstrated significant potential in cancer treatment due to its crucial role in bridging the innate and adaptive immunity. however, clinical attempts of current cgas-sting activating approaches remain challenged because of their undesired adverse effects and low therapeutic efficacy. we herein developed a new and robust immunostimulatory rna interfering (rnai) nanoplatform to potentiate breast cancer (bca) immunotherapy through precise activation of cgas-sting pathway and effective immune checkpoint blockade. this nanoplatform comprises the electrostatic complexes of small interfering rna (sirna) targeting oncogene coactivator-associated arginine methyltransferase 1 (carm1) and metformin prodrug. using orthotopic and metastatic bca tumors, we demonstrated this nanoplatform could suppress the proliferation of bca cells via sirna-mediated carm1 silencing and down-regulate programmed death-ligand 1 (pd-l1) expression via metformin-mediated ubiquitin-proteasome degradation. more importantly, due to the important role of oncogene carm1 in repairing damaged double stand dna (dsdna), carm1 silencing could specifically enhance the accumulation of damaged dsdna and cytosolic release of dsdna fragments to precisely activate the cgas-sting pathway in bca cells, which could thus promote their expression and secretion of interferon-beta (ifn-beta) to induce a significant inhibition of bca tumor growth via leveraging both the innate and adaptive immunity.",2026 Apr 10,41655906.0,PubMed,,Undetermined / Default,4.0,-1,4.0
