title,abstract,year,pmid,source,paperId,study_design,base_score,sample_size,evidence_score
niosomal co-delivery of metformin and telaglenastat: a targeted nanotherapeutic strategy for breast cancer treatment and metastasis suppression in 2d and 3d models.,"overexpression of glucose transporter-1 (glut-1) and glutaminase-1 (gls-1) underlies the metabolic dependence of breast cancer cells on glucose and glutamine. exploiting this vulnerability, a dual-drug niosomal delivery system was developed for the encapsulation of metformin (met) and telaglenastat (tel) to concurrently modulate these metabolic pathways. the optimized formulation, prepared at a cholesterol:span 60 ratio of 1:1, exhibited nanosized vesicles (79.7-494.6 nm) with low polydispersity (pdi < 0.3), confirming a uniform and suitable size distribution for efficient cellular uptake. the encapsulation efficiency (ee%) was high for both agents, notably 84.34 % for tel and 67.93 % for met. flow-cytometric profiling revealed elevated glut-1 and gls-1 expression relative to unstained controls, validating the rationale for dual-pathway targeting. functionally, the niosomal formulations outperformed free and single-drug treatments across both two- and three-dimensional models. in 3d spheroids, free tel (200 microm) and free met (200 mm) resulted in cell viabilities of 44.97 % and 54.00 %, respectively, whereas tel-np and met-np reduced viability to 9.49 % and 22.14 %, representing 4.7-and 2.4-fold enhancements in cytotoxic efficacy. the dual formulation promoted extensive spheroid disintegration and maintained intratumoral penetration for up to 72 h. in wound-healing assays, significant inhibition of migration was observed, with residual wound areas of 97.07 % (met-np), 87.43 % (tel-np), and 93.49 % (combined met-np + tel-np). metabolic analyses further substantiated the mechanistic effect of dual inhibition. glutamine-glutamate quantification demonstrated a marked shift from the untreated profile (glutamate 87.77 % / glutamine 12.23-59.89 % / 40.11 %) following combined nanoparticle treatment, consistent with suppression of gls-1-mediated glutaminolysis. correspondingly, ros-glo h(2)o(2) assays revealed decreased intracellular hydrogen peroxide in all treated groups, with the most pronounced reduction observed in the dual-np combination, indicating attenuation of oxidative stress and restoration of redox balance. in conclusion, coordinated inhibition of glut-1- and gls-1-driven metabolism via met/tel-loaded niosomes achieves enhanced cytotoxicity, durable spheroid penetration, and strong anti-migratory and metabolic modulatory effects. this stable co-delivery platform represents a promising nanotherapeutic strategy to overcome metabolic adaptability and treatment resistance in breast cancer.",2025 Dec,41344098.0,PubMed,,Undetermined / Default,4.0,-1,4.0
metformin impairs breast cancer growth through the inhibition of prmt6.,"metformin is the world's widely prescribed oral medication for the treatment of type 2 diabetes mellitus, which is also shown to repress tumorigenesis without a complete understanding of its therapeutic targets. here, it is shown that metformin impairs the growth of breast cancer cells by inhibiting prmt6, a protein arginine methyltransferase primarily responsible for asymmetric dimethylation of histone h3 arginine 2 (h3r2me2a). mechanistically, metformin directly binds prmt6 and inhibits its activity to methylate h3r2, leading to prmt6 transcriptional repression and further reduces h3r2me2a. by decreasing prmt6-catalyzed h3r2me2a, metformin enhances the chromatin association of uhrf1, an accessory factor of dnmt1 to promote dna methylation and repress the transcription of dna replication-associated genes, resulting in retarded dna replication and cell cycle arrest. metformin and a dna replication inhibitor synergistically inhibit tumor growth. furthermore, genetic disruption of the interaction between metformin and prmt6 attenuates the inhibitory effect of metformin on breast cancer growth. together, this work identifies a previously unrecognized mechanism for metformin to inhibit breast cancer growth.",2026 Feb,41327885.0,PubMed,,Undetermined / Default,4.0,-1,4.0
autophagy stimulation influenced the angiogenesis and metastasis behavior of human triple-negative breast cancer cells.,"introduction: breast cancer (bc) is a devastating condition with high morbidity and mortality rates in females. autophagy is an early-stage cell response against stressful conditions. emerging data have revealed the autophagy-angiogenesis interaction in terms of tumor development and metastasis. methods: here, the angiogenesis behavior of human mda-mb-231 cells was monitored after modulation of autophagy response in the presence of free 3-methyladenine (3-ma), metformin (met), or drug-loaded exosomes (3-ma@exos and met@exos). orthotopic transplantation was done using human bc cell-laden alginate/gelatin (alg/gel) microspheres in mice after treatment with met and/or 3-ma. results: met, and/or met@exos increased the cell migration rate and promoted human endothelial cell migration compared to the control cells (p<0.05). however, these features were blunted in 3-ma and 3-ma@exos groups (p<0.05). flow cytometry analysis revealed that the drug loading into exos did not influence internalization capacity or cell survival (p>0.05). elisa revealed that vascular endothelial growth factor (vegf) levels were reduced in met and 3-ma-treated cells, with more pronounced reductions in the free 3-ma groups. real-time pcr analysis showed diminished expression of several angiogenesis-related genes, except for platelet endothelial cell adhesion molecule-1 (pecam-1) in the met@exos, 3-ma, and 3-ma@exos groups. met treatment increased the metastasis and tumor formation in mice mammary glands after orthotopic transplantation of bc tumoroids. conclusion: these data indicate that autophagy modulation can alter the angiogenesis and metastatic behavior of human bc cells in vitro and in vivo. exos are valid bio-shuttles for the delivery of autophagy modulators in csc-targeted therapies.",2025,41322395.0,PubMed,,Preclinical Study (In Vitro / In Vivo Animal),2.0,-1,2.0
nir/us-responsive injectable hyaluronic acid-based nickel sulfide hydrogel as a smart platform for synergistic antitumor therapy.,"breast cancer is one of the most prevalent malignant tumors worldwide and a leading cause of cancer-related mortality, underscoring the urgent need for innovative therapeutic strategies. in this study, we developed an injectable hydrogel-based system, in which polyvinylpyrrolidone (pvp)-modified nis(2-x)@pvp nanospheres were incorporated with metformin hydrochloride (mh) and dispersed in a hyaluronic acid (ha) hydrogel matrix to form the nis(2-x)@pvp@ha tumor treatment platform. this system exhibits excellent photothermal performance under near-infrared (nir) light irradiation and can be employed for tumor photothermal therapy (ptt). the ni(2+) released from the degradation of nis(2-x)@pvp nanospheres can catalyze the decomposition of endogenous hydrogen peroxide in tumor cells, thereby generating toxic hydroxyl radicals for chemodynamic therapy (cdt). by altering the ha concentration, the internal pore structure, mechanical properties, drug release behavior, and swelling capacity of the hydrogel can be modulated. the loaded antitumor drug mh further enhances the therapeutic efficacy. under nir and ultrasound stimulation, this platform enables controlled drug release. in vitro and in vivo experiments have demonstrated that the nis(2-x)@pvp@ha hydrogel achieves the synergistic treatment of ptt/cdt/chemotherapy for tumor tissues. kyoto encyclopedia of genes and genomes pathway analysis suggested that activation of the mapk signaling pathway was a key mechanism underlying tumor cell death. this work presents a rational design strategy that addresses the related challenges in breast cancer and promotes precise cancer therapy.",2026 Jan,41308779.0,PubMed,,Preclinical Study (In Vitro / In Vivo Animal),2.0,-1,2.0
impact of sodium glucose cotransporter 2 inhibitors on bladder cancer and breast cancer: a pharmacovigilance analysis and mendelian randomization study.,"background: there is conflicting real-world evidence regarding the risk of breast and bladder cancer associated with sodium glucose cotransporter 2 (sglt2) inhibitors. we conducted a pharmacovigilance study on sglt2 inhibitors and breast and bladder cancer using the us fda adverse event reporting system (faers) and a mendelian randomization (mr) study. research design and methods: we used aersmine to mine adverse events from faers. we provided proportional reporting ratio (prr) with 95% confidence interval (ci), and the lower limit of the 95% credible interval of the information component (ic(025)). a two-sample mr approach was used to investigate the causal relationship between sglt2 inhibition and breast and bladder cancer. results: we did not find a disproportionate association between sglt2 inhibitors (prr = 1.26; 95%ci 1.05-1.51; p = 0.014; ic(025) = 0.01) and their molecules with breast cancer. sglt2 inhibitors were associated with a disproportionately higher reporting frequency of bladder cancer events compared to metformin, dipeptidyl peptidase 4 inhibitors, or glucagon-like peptide-1 receptor agonists. mr analysis results showed that sglt2 inhibition was associated with a higher risk of bladder cancer (odds ratio 1.01; 95%ci 1.00-1.01; p = 0.004). conclusion: our results suggest that the use of sglt2 inhibitors is associated with a higher reporting frequency/risk of bladder cancer, rather than breast cancer.",2025 Nov 27,41283794.0,PubMed,,Undetermined / Default,4.0,-1,4.0
"investigations of potential therapeutic targets from high-throughput, label-free, quantitative proteomic studies in mda-mb-468 cells treated with metformin and electrical pulses.","high-throughput, label-free quantitative proteomic analyses, along with cell viability and reactive oxygen species (ros) studies, were performed on mda-mb-468 human triple-negative breast cancer (tnbc) cells, to gain mechanistic insights into therapeutic actions. tnbc was chosen as it is the most lethal subtype of breast cancer, highly aggressive, prone to recurrence and metastasis, with the highest prevalence in black women. the absence of specific biomarkers limits targeted therapies. this unmet need was studied using proteomics, after treating the cells with electrical pulses (ep) combined with metformin (met). with the ep + met treatment (1000 v/cm, 1 mm), cell viability dropped to 25.6 % after 24 h and ros increased to 179 %, compared to control at 100 %. proteomics revealed 125 upregulated and 37 downregulated proteins in ep + met, compared to met alone, involving enzymes, proliferation markers, and kinases. key gene changes included upregulation of alad, mki67, and lrch4, and downregulation of eif1ax, nsun5, and gns. lrch4 and gns are suggested to be potential novel therapeutic targets, as lrch4 upregulation links to inhibition of the mtor/pi3k/akt pathway, reducing proliferation, while gns downregulation suppresses tumor growth and metastasis. overall, proteomics-based preliminary findings suggest that ep + met modulate tnbc pathways, identifying potential biomarkers and providing a foundation for future validation.",2026 Mar,41232409.0,PubMed,,Undetermined / Default,4.0,-1,4.0
"lep and foxo1 genes, as a proposed tumor suppressor autophagic cell death related genes, can be targeted by antidiabetic therapy in nondiabetic breast cancer patients.","introduction: breast cancer can be treated effectively with personalized, gene-targeted therapies due to its molecular and genetic differences. our study aims to identify breast cancer-specific tumor suppressor genes related to autophagic cell death and discover new drugs that target these mechanisms, even if they are not breast cancer-specific. materials and methods: gene intensity values ​​of 457 tumor and 19 healthy breast tissues were used to determine downregulated and upregulated genes related to autophagy and apoptosis using bioconductor r program via limma package. then, genes affecting survival were identified by survival analysis via kaplan-meier plotter tool. furthermore, the signalling pathways associated with these genes and targeting candidate drug components were determined by gene enrichment analysis using ""kegg pathway option"" and drug matador in ""shinygo 0.82"" web-tool, respectively. results: breast cancer tumor tissues showed downregulation of genes related to autophagy and apoptosis (c19orf12, cryab, lep, srpx, snca, foxo1) and upregulation of others (slc7a5, atp2a2, inhba, atp5if1). among these, slc7a5, c19orf12, lep, sprx, snca, and foxo1 affected patient survival and prognosis. the ampk signaling pathway, targeting foxo1 and lep, was identified as key. only the lep gene was targeted by metformin, pioglitazone, rosiglitazone, and troglitazone. conclusion: in our study, survival associated lep and foxo1 genes were identified as candidate tumor suppressor genes associated with autophagic cell death in non-obese and non-diabetic breast cancer patients. anti-diabetic drugs such as metformin, pioglitazone, rosiglitazone, troglitazone are proposed as candidate components in the treatment processes by targeting the lep gene in nondiabetic breast cancer patients.",2025 Nov 10,41212318.0,PubMed,,Undetermined / Default,4.0,-1,4.0
metformin alleviates ribociclib-induced lung injury by restoring impaired autophagy via targeting mucolipin-1.,"ribociclib, a cornerstone cdk4/6 inhibitor for advanced breast cancer, carries a risk of serious pulmonary toxicity, including rare but fatal interstitial lung disease. this study demonstrates that ribociclib directly induces alveolar epithelial cell apoptosis, driving lung injury in mice and human alveolar epithelial cells. mechanistically, we identify an off-target activation of mucolipin-1 (mcoln1) as the critical event, which arrests autophagic flux by blocking autophagosome-lysosome fusion. moreover, this autophagic impairment precedes and precipitates apoptosis independently of cdk4/6 inhibition. crucially, we reveal the antidiabetic drug metformin as a potent therapeutic intervention. metformin rescues ribociclib-induced toxicity both in vitro and in vivo by restoring autophagic flux through suppressing mucolipin-1 expression to overcome the autophagosome-lysosome fusion blockade. this significantly attenuates epithelial apoptosis, inflammatory infiltration, and pathological damage in the lungs. our work provides the first demonstration of mucolipin-1-mediated autophagic arrest as the core mechanism underlying ribociclib's pulmonary toxicity and establishes metformin as a clinically actionable strategy for mitigation, highlighting autophagic flux restoration as a new paradigm for countering kinase inhibitor-related organ toxicities.",2026 Jan,41207516.0,PubMed,,Preclinical Study (In Vitro / In Vivo Animal),2.0,-1,2.0
"time-restricted eating and metformin in invasive breast cancer or dcis: a randomized, phase iib, presurgical trial. preliminary safety analysis.","cancer cells exhibit metabolic flexibility between anaerobic glycolysis and oxidative phosphorylation. preclinical data showed that metformin, an oxidative phosphorylation inhibitor, combined with fasting-induced hypoglycemia led to activation of the pp2a-gsk3ss-mcl1 axis and inhibition of tumor growth. a window-of-opportunity trial was designed to evaluate the effect of metformin and nightly fasting on proliferation in invasive breast cancer or ductal carcinoma in situ (dcis). the primary endpoint is the pretreatment/posttreatment change of ki67 in cancer tissue, and the co-primary endpoint is the difference in posttreatment ki67 in cancer-adjacent dcis or high-risk lesions. participants with hormone receptor-positive invasive breast cancer or dcis candidates to surgery are being accrued and randomized to either (i) fasting for >/=16 hours nightly, plus nutritional counseling and daily metformin with continuous glucose monitoring, or (ii) continuous glucose monitoring. the intervention lasts 4 to 6 weeks with gradual metformin ramp up to limit gastrointestinal disturbances. the safety of the combination was evaluated as a primary interim endpoint. the frequency of dose-limiting toxicity (>/=g3 adverse events related to treatment) was assessed in the first 14 participants in the experimental arm. most adverse events were of low grade (g1: 50; 90.9%) and unrelated to the treatment (g1: 26 unrelated; 52%). no one discontinued treatment because of toxicity, and no dose-limiting toxicities were observed, so the escalation phase of metformin was significantly shortened from 7 to 3 days. the results of this project will expand knowledge of this prevention approach and possibly provide the basis for large-scale primary prevention studies in at-risk women. prevention relevance: in a context of rising cancer drug costs, this research explores a low-cost treatment to optimize breast cancer preventive intervention. the approach is safe and based on repurposed drugs that could enhance prevention strategies for obesity- and insulin-related cancers, offering immediate applicability to a large-scale trial in women at risk.",2026 Jan 6,41165048.0,PubMed,,Undetermined / Default,4.0,14,3.0
an overview on the mechanism of metformin in the reduction of breast cancer.,"the incidence of diabetes is markedly increasing worldwide. in addition to cardiovascular complications, many epidemiological studies have demonstrated that diabetic patients have a markedly increased risk of developing many types of cancer and several meta-analyses have found that metformin, the most commonly prescribed medication for type 2 diabetes, is associated with a lower risk of developing several cancers. therefore, the suggested mechanism of metformin in the reduction of breast cancer will be discussed in this review.",2025 Sep,41164619.0,PubMed,,Systematic Review / Meta-Analysis,10.0,-1,10.0
associations of commonly used concomitant medications with survival and adverse event outcomes in breast cancer.,"background: the impact of commonly used non-cancer medications on breast cancer outcomes remains underexplored in large datasets. aims: to evaluate the associations between commonly used non-cancer medications and survival as well as adverse events in patients with breast cancer. materials & methods: individual participant data from 19 breast cancer clinical trials (n = 23,211) were pooled. cox proportional hazards models and logistic regression analyses were used to assess associations between medication use and overall survival, progression-free survival and grade >/= 3 adverse events. analyses were adjusted for demographic, cancer and comorbidity factors. results: proton pump inhibitor use was associated with poorer overall survival (hr 1.19, 95% ci: 1.08-1.30), progression-free survival (hr 1.11, 95% ci: 1.02-1.21) and an increased risk of grade >/= 3 adverse events (or 1.36, 95% ci: 1.21-1.53). beta-blockers, ace inhibitors/arbs and calcium channel blockers were linked with higher adverse event rates but showed no significant impact on survival. statins and metformin demonstrated no significant associations with either survival or adverse events. conclusion: these findings emphasise the need for careful management of concomitant medications in breast cancer care and support ongoing research to optimise treatment safety and efficacy.",2025 Nov,41163361.0,PubMed,,Clinical Trial (Phase I/II) / Prospective Cohort,8.0,23211,9.0
enhancing the efficacy of metformin in neoadjuvant therapy for breast cancer: a meta-analysis based on randomized clinical trials.,"introductionthis meta-analysis aims to evaluate the impact of increasing the use of metformin in neoadjuvant treatment for breast cancer (bc) on the rate of pathological complete response (pcr) in patients.methodsa systematic search was conducted in four electronic databases: pubmed, web of science, embase, and cochrane library. the search scope covered all the literature from the establishment of the databases to april 2025. the risk ratio (rr) and 95% confidence interval (ci) were calculated. the outcome indicator was the pcr rate.resultthis meta-analysis included a total of 8 randomized controlled trials (rcts), involving 474 patients. the results showed that there was no statistically significant difference in the pcr rate between the experimental group containing metformin and the control group (rr = 1.21, 95% ci: [0.85, 1.71], p = 0.28). subgroup analysis revealed that there were no significant differences in the pcr rate between the two groups in patients with metabolic syndrome (rr = 2.09, 95% ci [0.55, 7.85], p = 0.28), patients without metabolic syndrome (rr = 1.12, 95% ci [0.81, 1.55], p = 0.49), patients from eastern countries (rr = 1.15, 95% ci [0.63, 2.11], p = 0.65), and patients from western countries (rr = 1.32, 95% ci [0.75, 2.32], p = 0.34).conclusionthis study did not observe any effect of increasing the use of metformin on the pcr rate of patients in neoadjuvant treatment for bc.",2025 Jan-Dec,41161296.0,PubMed,,Systematic Review / Meta-Analysis,10.0,474,10.0
combination of simvastatin and metformin reduces triple-negative breast cancer tumor growth through akt/ampk/acc signaling axis.,"chemotherapy continues to be the standard of care for metastatic malignancies, such as triple-negative breast cancer (tnbc). although the treatment strategy increases survival rates marginally, it frequently leads to the development of resistant disease and side effects. it is imperative to develop an alternate chemotherapy formulation with better efficacy and lesser adverse effects in tnbc patients. cell viability and cholesterol level were measured using spectrophotometer and fluorometric assays. the 4t1 syngeneic balb/c female mice were used as an in vivo metastatic tnbc model. simvastatin (sim) and metformin (met) were administered in combination (3.5-7.0 and 175-350 mug/g body weight, respectively) and alone (sim 7.0 mug/g/day, or met 350 mug/g/day) orally over an 8-week period, and the standard anticancer drug docetaxel (doc) was administered at a dose of 24 mug/g body weight through ip injection every 3 weeks. phosphorylation levels of protein and histopathology of tumors were studied by immunoblot and h & e staining methods, respectively. we report that the viability of tnbc cells is significantly and synergistically reduced by sim and met co-treatment, with negligible adverse effects on normal breast cell line. sim met combination down regulates phosphorylation at specific sites of akt (ser-473/thr-308) and ampkalpha (ser-485/491) and up regulates acc phosphorylation (ser-79), which in turn minimizes the cellular cholesterol synthesis in the tnbc model. further study demonstrated that the combination significantly reduced tumor formation effectively than docetaxel. study confirmed that the combination of sim and met is a promising chemotherapeutic approach for metastatic tnbc.",2026 Jan,41118580.0,PubMed,,Preclinical Study (In Vitro / In Vivo Animal),2.0,-1,2.0
mda-mb-231 breast cancer cells adapted to anchorage-independent growth reveal senescent-like phenotype and persistent downregulation of pd-l1 expression.,"introduction: metastasis remains the primary cause of mortality in breast cancer, particularly in aggressive triple-negative (tnbc) subtypes. a crucial yet understudied aspect of this process involves cancer cell survival in a detached state and subsequent reattachment at distant sites. while in vitro models can capture early detachment events like tumor budding, the subsequent reattachment phase is often overlooked. to address this, we developed a tnbc cell model that effectively mimics metastatic behavior following re-attachment at secondary locations. methods: we generated clones of mda-mb-231 tnbc cells through consecutive selection for enhanced anchorage-independent survival. this was achieved using 2-deoxy-d-glucose (2dg) alone, 2dg combined with metformin, or poly(2-hydroxyethyl methacrylate) (polyhema)-coated surfaces. the resulting adapted clones were characterized by rna transcriptomics, comparing them to one-time treated non-selected cells. real-time cellular energy metabolism was assessed via seahorse analysis, while mitochondrial mass and intracellular localization were determined by flow cytometry and fluorescent microscopy, respectively. results: transcriptomic analysis of the mda-mb-231 clones adapted to anchorage-independent growth revealed distinct alterations in gene expression, confirmed by principal component analysis showing clear separation from control clusters. these adapted clones exhibited increased mesenchymal and stemness markers, downregulated cell cycle genes, and a senescent-like phenotype. interestingly, while nuclear-encoded oxidative phosphorylation (oxphos) genes were downregulated, mitochondrial-encoded oxphos genes were upregulated, with no significant shift in overall atp production as measured by seahorse analysis. paradoxically, despite increased cd274 (pd-l1) transcription, surface pd-l1 expression was consistently reduced, likely due to endoplasmic reticulum (er) stress and impaired n-glycosylation. discussion: our adapted clones provide a novel in vitro model of early metastatic behavior, unveiling a cancer cell survival strategy that balances energy metabolism with adaptation to stress. these clones also demonstrated enhanced detachment properties and upregulation of proto-oncogenes, in addition to their senescent-like phenotype. critically, the uncoupling of cd274 transcription from surface pd-l1 expression suggests a potential therapeutic vulnerability that could be exploited in tnbc.",2025,41103963.0,PubMed,,Preclinical Study (In Vitro / In Vivo Animal),2.0,-1,2.0
